[
  {
    "chapter_id": 1,
    "name": "Ashen Road",
    "slug": "1-1",
    "level": 1,
    "hero_slug": "astaroth",
    "energy_cost": 6,
    "chapter_title": "Ruled by Fire"
  },
  {
    "chapter_id": 1,
    "name": "Glades of Silence",
    "slug": "1-2",
    "level": 2,
    "energy_cost": 6,
    "chapter_title": "Ruled by Fire"
  },
  {
    "chapter_id": 1,
    "name": "Dry Dale",
    "slug": "1-3",
    "level": 3,
    "energy_cost": 6,
    "chapter_title": "Ruled by Fire"
  },
  {
    "chapter_id": 1,
    "name": "Smoky Crossroads",
    "slug": "1-4",
    "level": 4,
    "energy_cost": 6,
    "chapter_title": "Ruled by Fire"
  },
  {
    "chapter_id": 1,
    "name": "Merchant Camp",
    "slug": "1-5",
    "level": 5,
    "hero_slug": "ginger",
    "energy_cost": 12,
    "chapter_title": "Ruled by Fire"
  },
  {
    "chapter_id": 1,
    "name": "City Gate",
    "slug": "1-6",
    "level": 6,
    "energy_cost": 6,
    "chapter_title": "Ruled by Fire"
  },
  {
    "chapter_id": 1,
    "name": "City on Fire",
    "slug": "1-7",
    "level": 7,
    "energy_cost": 6,
    "chapter_title": "Ruled by Fire"
  },
  {
    "chapter_id": 1,
    "name": "Scorching Pavement",
    "slug": "1-8",
    "level": 8,
    "energy_cost": 6,
    "chapter_title": "Ruled by Fire"
  },
  {
    "chapter_id": 1,
    "name": "Elder's House",
    "slug": "1-9",
    "level": 9,
    "energy_cost": 6,
    "chapter_title": "Ruled by Fire"
  },
  {
    "chapter_id": 1,
    "name": "Marax the Titan's Domain",
    "slug": "1-10",
    "level": 10,
    "hero_slug": "mojo",
    "energy_cost": 18,
    "chapter_title": "Ruled by Fire"
  },
  {
    "chapter_id": 2,
    "name": "Wilheim",
    "slug": "2-1",
    "level": 1,
    "hero_slug": "thea",
    "energy_cost": 12,
    "chapter_title": "Distorted Magic"
  },
  {
    "chapter_id": 2,
    "name": "Reaper's Cabin",
    "slug": "2-2",
    "level": 2,
    "energy_cost": 6,
    "chapter_title": "Distorted Magic"
  },
  {
    "chapter_id": 2,
    "name": "Outskirts",
    "slug": "2-3",
    "level": 3,
    "energy_cost": 6,
    "chapter_title": "Distorted Magic"
  },
  {
    "chapter_id": 2,
    "name": "Overgrown Path",
    "slug": "2-4",
    "level": 4,
    "energy_cost": 6,
    "chapter_title": "Distorted Magic"
  },
  {
    "chapter_id": 2,
    "name": "Thick Forest",
    "slug": "2-5",
    "level": 5,
    "energy_cost": 6,
    "chapter_title": "Distorted Magic"
  },
  {
    "chapter_id": 2,
    "name": "Outskirts of Wilheim",
    "slug": "2-6",
    "level": 6,
    "hero_slug": "galahad",
    "energy_cost": 12,
    "chapter_title": "Distorted Magic"
  },
  {
    "chapter_id": 2,
    "name": "Monolith of Meron",
    "slug": "2-7",
    "level": 7,
    "energy_cost": 6,
    "chapter_title": "Distorted Magic"
  },
  {
    "chapter_id": 2,
    "name": "Secret Ford",
    "slug": "2-8",
    "level": 8,
    "energy_cost": 6,
    "chapter_title": "Distorted Magic"
  },
  {
    "chapter_id": 2,
    "name": "River of Oblivion",
    "slug": "2-9",
    "level": 9,
    "energy_cost": 6,
    "chapter_title": "Distorted Magic"
  },
  {
    "chapter_id": 2,
    "name": "Magic Thicket",
    "slug": "2-10",
    "level": 10,
    "hero_slug": "astaroth",
    "energy_cost": 12,
    "chapter_title": "Distorted Magic"
  },
  {
    "chapter_id": 2,
    "name": "Marax' Trace",
    "slug": "2-11",
    "level": 11,
    "energy_cost": 6,
    "chapter_title": "Distorted Magic"
  },
  {
    "chapter_id": 2,
    "name": "Nameless Road",
    "slug": "2-12",
    "level": 12,
    "energy_cost": 6,
    "chapter_title": "Distorted Magic"
  },
  {
    "chapter_id": 2,
    "name": "Deadlands",
    "slug": "2-13",
    "level": 13,
    "energy_cost": 6,
    "chapter_title": "Distorted Magic"
  },
  {
    "chapter_id": 2,
    "name": "Seal of Fire",
    "slug": "2-14",
    "level": 14,
    "energy_cost": 6,
    "chapter_title": "Distorted Magic"
  },
  {
    "chapter_id": 2,
    "name": "Lava Fracture",
    "slug": "2-15",
    "level": 15,
    "hero_slug": "aurora",
    "energy_cost": 10,
    "chapter_title": "Distorted Magic"
  },
  {
    "chapter_id": 3,
    "name": "Outpost",
    "slug": "3-1",
    "level": 1,
    "hero_slug": "phobos",
    "energy_cost": 12,
    "chapter_title": "Hardan's Plateau"
  },
  {
    "chapter_id": 3,
    "name": "Rocky Wasteland",
    "slug": "3-2",
    "level": 2,
    "energy_cost": 6,
    "chapter_title": "Hardan's Plateau"
  },
  {
    "chapter_id": 3,
    "name": "Grog's Stairway",
    "slug": "3-3",
    "level": 3,
    "energy_cost": 6,
    "chapter_title": "Hardan's Plateau"
  },
  {
    "chapter_id": 3,
    "name": "Dusty Cliff",
    "slug": "3-4",
    "level": 4,
    "energy_cost": 6,
    "chapter_title": "Hardan's Plateau"
  },
  {
    "chapter_id": 3,
    "name": "Rotten Ravine",
    "slug": "3-5",
    "level": 5,
    "energy_cost": 6,
    "chapter_title": "Hardan's Plateau"
  },
  {
    "chapter_id": 3,
    "name": "Living Mountains",
    "slug": "3-6",
    "level": 6,
    "hero_slug": "keira",
    "energy_cost": 12,
    "chapter_title": "Hardan's Plateau"
  },
  {
    "chapter_id": 3,
    "name": "Dilapidated Bridge",
    "slug": "3-7",
    "level": 7,
    "energy_cost": 6,
    "chapter_title": "Hardan's Plateau"
  },
  {
    "chapter_id": 3,
    "name": "Scorched Lands",
    "slug": "3-8",
    "level": 8,
    "energy_cost": 6,
    "chapter_title": "Hardan's Plateau"
  },
  {
    "chapter_id": 3,
    "name": "Road of Mourning",
    "slug": "3-9",
    "level": 9,
    "energy_cost": 6,
    "chapter_title": "Hardan's Plateau"
  },
  {
    "chapter_id": 3,
    "name": "Sanctuary of The Ancestors",
    "slug": "3-10",
    "level": 10,
    "hero_slug": "fox",
    "energy_cost": 12,
    "chapter_title": "Hardan's Plateau"
  },
  {
    "chapter_id": 3,
    "name": "Fir Valley",
    "slug": "3-11",
    "level": 11,
    "energy_cost": 6,
    "chapter_title": "Hardan's Plateau"
  },
  {
    "chapter_id": 3,
    "name": "Camp Approach",
    "slug": "3-12",
    "level": 12,
    "energy_cost": 6,
    "chapter_title": "Hardan's Plateau"
  },
  {
    "chapter_id": 3,
    "name": "Orcish Patrol",
    "slug": "3-13",
    "level": 13,
    "energy_cost": 6,
    "chapter_title": "Hardan's Plateau"
  },
  {
    "chapter_id": 3,
    "name": "Frontier Camp",
    "slug": "3-14",
    "level": 14,
    "energy_cost": 6,
    "chapter_title": "Hardan's Plateau"
  },
  {
    "chapter_id": 3,
    "name": "Leader's Tent",
    "slug": "3-15",
    "level": 15,
    "hero_slug": "mojo",
    "energy_cost": 18,
    "chapter_title": "Hardan's Plateau"
  },
  {
    "chapter_id": 4,
    "name": "Shepherds' Lands",
    "slug": "4-1",
    "level": 1,
    "hero_slug": "heidi",
    "energy_cost": 12,
    "chapter_title": "Deadlands"
  },
  {
    "chapter_id": 4,
    "name": "Dry Wind",
    "slug": "4-2",
    "level": 2,
    "energy_cost": 6,
    "chapter_title": "Deadlands"
  },
  {
    "chapter_id": 4,
    "name": "Edge of Dusk",
    "slug": "4-3",
    "level": 3,
    "energy_cost": 6,
    "chapter_title": "Deadlands"
  },
  {
    "chapter_id": 4,
    "name": "Surrounding Highway",
    "slug": "4-4",
    "level": 4,
    "energy_cost": 6,
    "chapter_title": "Deadlands"
  },
  {
    "chapter_id": 4,
    "name": "Trial by Darkness",
    "slug": "4-5",
    "level": 5,
    "energy_cost": 6,
    "chapter_title": "Deadlands"
  },
  {
    "chapter_id": 4,
    "name": "Burnt Canyon",
    "slug": "4-6",
    "level": 6,
    "hero_slug": "ginger",
    "energy_cost": 12,
    "chapter_title": "Deadlands"
  },
  {
    "chapter_id": 4,
    "name": "Ashes and Coal",
    "slug": "4-7",
    "level": 7,
    "energy_cost": 6,
    "chapter_title": "Deadlands"
  },
  {
    "chapter_id": 4,
    "name": "At Worlds' End",
    "slug": "4-8",
    "level": 8,
    "energy_cost": 6,
    "chapter_title": "Deadlands"
  },
  {
    "chapter_id": 4,
    "name": "Bottomless Chasm",
    "slug": "4-9",
    "level": 9,
    "energy_cost": 6,
    "chapter_title": "Deadlands"
  },
  {
    "chapter_id": 4,
    "name": "Necropolis",
    "slug": "4-10",
    "level": 10,
    "hero_slug": "keira",
    "energy_cost": 12,
    "chapter_title": "Deadlands"
  },
  {
    "chapter_id": 4,
    "name": "Granite of Silence",
    "slug": "4-11",
    "level": 11,
    "energy_cost": 6,
    "chapter_title": "Deadlands"
  },
  {
    "chapter_id": 4,
    "name": "Death Shroud",
    "slug": "4-12",
    "level": 12,
    "energy_cost": 6,
    "chapter_title": "Deadlands"
  },
  {
    "chapter_id": 4,
    "name": "In the Afterlife",
    "slug": "4-13",
    "level": 13,
    "energy_cost": 6,
    "chapter_title": "Deadlands"
  },
  {
    "chapter_id": 4,
    "name": "Atrium",
    "slug": "4-14",
    "level": 14,
    "energy_cost": 6,
    "chapter_title": "Deadlands"
  },
  {
    "chapter_id": 4,
    "name": "Gravehall Estate",
    "slug": "4-15",
    "level": 15,
    "hero_slug": "thea",
    "energy_cost": 12,
    "chapter_title": "Deadlands"
  },
  {
    "chapter_id": 5,
    "name": "Smagard Terraces",
    "slug": "5-1",
    "level": 1,
    "energy_cost": 6,
    "chapter_title": "Cadang Thicket"
  },
  {
    "chapter_id": 5,
    "name": "Obelisk",
    "slug": "5-2",
    "level": 2,
    "hero_slug": "galahad",
    "energy_cost": 12,
    "chapter_title": "Cadang Thicket"
  },
  {
    "chapter_id": 5,
    "name": "Emerald Dust",
    "slug": "5-3",
    "level": 3,
    "energy_cost": 6,
    "chapter_title": "Cadang Thicket"
  },
  {
    "chapter_id": 5,
    "name": "Exit from Gravehall",
    "slug": "5-4",
    "level": 4,
    "energy_cost": 6,
    "chapter_title": "Cadang Thicket"
  },
  {
    "chapter_id": 5,
    "name": "Blinding Light",
    "slug": "5-5",
    "level": 5,
    "energy_cost": 6,
    "chapter_title": "Cadang Thicket"
  },
  {
    "chapter_id": 5,
    "name": "Flourishing Life",
    "slug": "5-6",
    "level": 6,
    "hero_slug": "aurora",
    "energy_cost": 12,
    "chapter_title": "Cadang Thicket"
  },
  {
    "chapter_id": 5,
    "name": "Poisonous Lashes",
    "slug": "5-7",
    "level": 7,